{
  "id": "fact-math-perfect-numbers",
  "topic": "math",
  "title": "Совершенные числа",
  "caption": "Равны сумме своих делителей кроме себя: 6, 28, 496, 8128. Все известные чётные. Нечётных не найдено. Проблема возрастом 2300 лет.",
  "image": "fact-math-perfect-numbers.webp",
  "image_width": 1280,
  "image_height": 1011,
  "alt": "Совершенные числа",
  "credit": "Xnou · CC-BY-SA · Wikimedia",
  "source": "https://en.wikipedia.org/wiki/Perfect_number",
  "license": "CC-BY-SA",
  "year": 2022
}
