{
  "id": "fact-art-banks",
  "topic": "art",
  "title": "Джозеф Бэнкс",
  "caption": "1743–1820. Ботаник на «Индеворе» с Куком, 1768. Florilegium — 743 гравюры новых растений Австралии и Полинезии. Опубликован только в 1980-х.",
  "image": "fact-art-banks.webp",
  "image_width": 646,
  "image_height": 800,
  "alt": "Сэр Джозеф Бэнкс",
  "credit": "Joshua Reynolds · PD · Wikimedia",
  "source": "https://en.wikipedia.org/wiki/Joseph_Banks",
  "license": "PD",
  "year": 1768
}
