{
  "id": "fact-art-discus-thrower-myron",
  "topic": "art",
  "title": "Дискобол · Мирон",
  "caption": "Мирон, ~450 до н.э. Бронзовая скульптура греческого спортсмена в момент броска. Оригинал утерян. Все известные копии — римские I–II века.",
  "image": "fact-art-discus-thrower-myron.webp",
  "image_width": 1280,
  "image_height": 2065,
  "alt": "Дискобол Мирона",
  "credit": "No machine-readable author provided. MatthiasKabel assumed (based on copyright c",
  "source": "https://en.wikipedia.org/wiki/Discobolus",
  "license": "CC-BY",
  "year": -450
}
