{
  "id": "fact-art-cuvier",
  "topic": "art",
  "title": "Жорж Кювье",
  "caption": "1769–1832. Отец палеонтологии. Доказал — виды вымирают. Восстановил мегатериума, мастодонта по костям. Противник эволюции, верил в катастрофы.",
  "image": "fact-art-cuvier.webp",
  "image_width": 814,
  "image_height": 1018,
  "alt": "Жорж Кювье",
  "credit": "Georges_Cuvier.jpg: Unknown derivative work: Beao · PD · Wikimedia",
  "source": "https://en.wikipedia.org/wiki/Georges_Cuvier",
  "license": "PD",
  "year": 2010
}
