{
  "id": "fact-nature-coral-reef-2",
  "topic": "nature",
  "title": "Коралловый риф",
  "caption": "Подводный город. 25% морских видов живут в рифах при том, что они занимают 0,1% морского дна. С 1950 потеряно 50% кораллов.",
  "image": "fact-nature-coral-reef-2.webp",
  "image_width": 1200,
  "image_height": 1600,
  "alt": "Коралловый риф",
  "credit": "Richard Ling &lt;wikipedia@rling.com&gt; · CC-BY-SA · Wikimedia",
  "source": "https://en.wikipedia.org/wiki/Coral_reef",
  "license": "CC-BY-SA",
  "year": 2004
}
