{
  "id": "fact-art-olympia",
  "topic": "art",
  "title": "Олимпия · Мане",
  "caption": "Эдуар Мане, 1863. 130×190 см. Скандал в Салоне 1865 — обнажённая женщина смотрит прямо на зрителя. Купертина Венеры Урбинской Тициана.",
  "image": "fact-art-olympia.webp",
  "image_width": 1280,
  "image_height": 866,
  "alt": "«Олимпия» Мане",
  "credit": "Édouard Manet · PD · Wikimedia",
  "source": "https://en.wikipedia.org/wiki/Olympia_(Manet)",
  "license": "PD",
  "year": 1865,
  "meta": {
    "artist": "Édouard Manet"
  }
}
