{
  "id": "fact-economy-tulip-mania",
  "topic": "economy",
  "title": "Тюльпанная лихорадка",
  "caption": "Голландия, 1634–1637. Луковица Semper Augustus в феврале 1637 стоила 5500 гульденов — 10 годовых зарплат ремесленника. Первый пузырь в истории.",
  "image": "fact-economy-tulip-mania.webp",
  "image_width": 613,
  "image_height": 1022,
  "alt": "Каталог редких тюльпанов 1637",
  "credit": "Unknown authorUnknown author · CC-BY-SA · Wikimedia",
  "source": "https://en.wikipedia.org/wiki/Tulip_mania",
  "license": "CC-BY-SA",
  "year": 1637
}
