{
  "id": "fact-country-norway-trolltunga",
  "topic": "country",
  "title": "Норвегия · Язык тролля",
  "caption": "Скала-выступ 700 м над фьордом Рингедалсватн. 27 км пешком к ней — 10 часов. Стала культовой в Instagram-эре с 2010-х.",
  "image": "fact-country-norway-trolltunga.webp",
  "image_width": 1280,
  "image_height": 960,
  "alt": "Trolltunga в Норвегии",
  "credit": "kallerna · CC-BY-SA · Wikimedia",
  "source": "https://en.wikipedia.org/wiki/Trolltunga",
  "license": "CC-BY-SA",
  "year": 2017,
  "meta": {
    "country_code": "NO"
  }
}
