{
  "id": "fact-art-cassandre",
  "topic": "art",
  "title": "Кассандр",
  "caption": "Адольф Кассандр, 1901–1968. «Этуаль дю Нор» (1927), «Норманди» (1935). Логотип Yves Saint Laurent (1961). Отец европейского графического дизайна.",
  "image": "fact-art-cassandre.webp",
  "image_width": 1280,
  "image_height": 1741,
  "alt": "Постеры Кассандра",
  "credit": "Ron Kroon / Anefo · CC0 · Wikimedia",
  "source": "https://en.wikipedia.org/wiki/Cassandre",
  "license": "CC0",
  "year": 1935
}
