{
  "id": "fact-science-nightingale",
  "topic": "science",
  "title": "Флоренс Найтингейл",
  "caption": "1820–1910. Крымская война 1854 — переустроила военный госпиталь Скутари. Снизила смертность с 42% до 2%. Основала современное сестринское дело.",
  "image": "fact-science-nightingale.webp",
  "image_width": 1105,
  "image_height": 1536,
  "alt": "Флоренс Найтингейл",
  "credit": "Henry Hering (1814-1893) · PD · Wikimedia",
  "source": "https://en.wikipedia.org/wiki/Florence_Nightingale",
  "license": "PD",
  "year": 1854
}
