{
  "id": "fact-architecture-saint-basil",
  "topic": "architecture",
  "title": "Собор Василия Блаженного",
  "caption": "Москва, Красная площадь, 1561. 9 церквей под 9 куполами. По легенде, Иван Грозный ослепил зодчих, чтобы не повторили.",
  "image": "fact-architecture-saint-basil.webp",
  "image_width": 1280,
  "image_height": 1419,
  "alt": "Собор Василия Блаженного на Красной площади",
  "credit": "Tsy1980 · CC-BY-SA · Wikimedia",
  "source": "https://en.wikipedia.org/wiki/Saint_Basil's_Cathedral",
  "license": "CC-BY-SA",
  "year": 1561,
  "meta": {
    "country_code": "RU"
  }
}
