{
  "id": "fact-terms-overton-window",
  "topic": "terms",
  "title": "Окно Овертона",
  "caption": "Джозеф Овертон, 1990-е. Диапазон идей, приемлемых для общественного обсуждения. Со временем смещается — что было табу, становится нормой.",
  "image": "fact-terms-overton-window.webp",
  "image_width": 1280,
  "image_height": 1899,
  "alt": "Схема окна Овертона",
  "credit": "Hydrargyrum · CC-BY-SA · Wikimedia",
  "source": "https://en.wikipedia.org/wiki/Overton_window",
  "license": "CC-BY-SA",
  "year": 1995
}
