{
  "id": "fact-country-greece-athens",
  "topic": "country",
  "title": "Греция · Афины",
  "caption": "Старейшая столица Европы — 3400 лет. Колыбель демократии (V в. до н.э.). Акрополь возвышается на 156 м.",
  "image": "fact-country-greece-athens.webp",
  "image_width": 1280,
  "image_height": 853,
  "alt": "Афины Акрополь",
  "credit": "dronepicr · CC-BY · Wikimedia",
  "source": "https://en.wikipedia.org/wiki/Athens",
  "license": "CC-BY",
  "year": 2018,
  "meta": {
    "country_code": "GR"
  }
}
